<?xml version="1.0" encoding="UTF-8"?>
<!-- 
    author: Borja
    date: 17/01/2023
    description: XML03
-->
<!DOCTYPE historia SYSTEM "03.dtd">
<historia xmlns:xsi="http://www.w3.org/2001/XMLSchema-instance" xsi:noNamespaceSchemaLocation="03.xsd">
    <linea>
        <descripcion>Se funda Youtube</descripcion>
        <fecha>
            <dia>15</dia>
            <mes>2</mes>
            <anyo>2005</anyo>
        </fecha>
    </linea>
    <linea>
        <descripcion>Se funda Google</descripcion>
        <fecha>
            <dia>4</dia>
            <mes>9</mes>
            <anyo>1998</anyo>
        </fecha>
    </linea>
    <linea>
        <descripcion>Se funda Facebook</descripcion>
        <fecha>
            <dia>4</dia>
            <mes>2</mes>
            <anyo>2004</anyo>
        </fecha>
    </linea>
</historia>